{
  "$schema": "https://sstory.example/schemas/phase5-protected-control.schema.json",
  "schema_version": "1.0.0",
  "type": "sstory-phase5-protected-metatile-control",
  "coordinate_reference_system": "EA-WORLD-1",
  "generated_by": "sstory-map-production/render_phase5_metatile_controls.py@1",
  "sheet_id": "sheet_region_lumiera_arch_region",
  "column": 0,
  "row": 1,
  "dimensions": {
    "width": 2048,
    "height": 2048,
    "format": "PNG"
  },
  "visual_geometry_control": {
    "path": "world/map-production/controls/phase5-metatiles/sheet_region_lumiera_arch_region/c00-r01/geometry-control.png",
    "sha256": "56945f69ba4e750b85dc48de62bfb44dde96a9b0246e0516c412281f31fd71af",
    "width": 2048,
    "height": 2048,
    "format": "PNG",
    "color_mode": "RGB"
  },
  "parent_context": {
    "path": "world/map-production/controls/phase5-metatiles/sheet_region_lumiera_arch_region/c00-r01/parent-context.png",
    "sha256": "5c1500e1ec486bb01f34035bbcb96579075b88e419a58f1b4eebb98b44db45ff",
    "width": 2048,
    "height": 2048,
    "format": "PNG",
    "color_mode": "RGB"
  },
  "prior_neighbor_contexts": [
    {
      "direction": "north",
      "source_tile": {
        "column": 0,
        "row": 0
      },
      "context": {
        "path": "world/map-production/controls/phase5-metatiles/sheet_region_lumiera_arch_region/c00-r01/neighbor-north-geometry-context.png",
        "sha256": "eea1c1fb7bb3d68b72ceecff3a85a6cd59ce2f068c6514a28254c6672e37ed74",
        "width": 2048,
        "height": 2048,
        "format": "PNG",
        "color_mode": "RGB"
      }
    }
  ],
  "land_sea": {
    "land_mask": {
      "path": "world/map-production/controls/phase5-metatiles/sheet_region_lumiera_arch_region/c00-r01/land-mask.png",
      "sha256": "65398aeda811f4f25637419019f93a7fb8b4f8ed462a1c3f2657a9a018de342a",
      "width": 2048,
      "height": 2048,
      "format": "PNG",
      "color_mode": "L"
    },
    "water_mask": {
      "path": "world/map-production/controls/phase5-metatiles/sheet_region_lumiera_arch_region/c00-r01/water-mask.png",
      "sha256": "07fd456de86841e8a69a901f8a2d57db1f95efbd766fb758a01048e8e6eb9cbc",
      "width": 2048,
      "height": 2048,
      "format": "PNG",
      "color_mode": "L"
    },
    "known_mask": {
      "path": "world/map-production/controls/phase5-metatiles/sheet_region_lumiera_arch_region/c00-r01/known-mask.png",
      "sha256": "12c77e4a41a055f618d9aa992c2950d8366a5b2cb554644eac215f5e814c8358",
      "width": 2048,
      "height": 2048,
      "format": "PNG",
      "color_mode": "L"
    },
    "unknown_mask": {
      "path": "world/map-production/controls/phase5-metatiles/sheet_region_lumiera_arch_region/c00-r01/unknown-mask.png",
      "sha256": "bc1ccaedb8aad8de3e64ef7b2d4fa2099f917e9995488e376bc94899c40c6fa8",
      "width": 2048,
      "height": 2048,
      "format": "PNG",
      "color_mode": "L"
    },
    "authoritative_overlay": {
      "path": "world/map-production/controls/phase5-metatiles/sheet_region_lumiera_arch_region/c00-r01/land-sea-overlay.png",
      "sha256": "5c1500e1ec486bb01f34035bbcb96579075b88e419a58f1b4eebb98b44db45ff",
      "width": 2048,
      "height": 2048,
      "format": "PNG",
      "color_mode": "RGB"
    },
    "partition": {
      "algorithm": "canon-land-water-unknown-partition-v1",
      "pixel_count": 4194304,
      "land_pixel_count": 3931534,
      "water_pixel_count": 262770,
      "unknown_pixel_count": 0,
      "overlap_pixel_count": 0,
      "unclassified_pixel_count": 0
    }
  },
  "transport": {
    "mask": {
      "path": "world/map-production/controls/phase5-metatiles/sheet_region_lumiera_arch_region/c00-r01/transport-mask.png",
      "sha256": "bc1ccaedb8aad8de3e64ef7b2d4fa2099f917e9995488e376bc94899c40c6fa8",
      "width": 2048,
      "height": 2048,
      "format": "PNG",
      "color_mode": "L"
    },
    "authoritative_overlay": {
      "path": "world/map-production/controls/phase5-metatiles/sheet_region_lumiera_arch_region/c00-r01/transport-overlay.png",
      "sha256": "6e84541fac14f31507b9d68f110245775261bfd6f75fb997b4b053e25a0614b0",
      "width": 2048,
      "height": 2048,
      "format": "PNG",
      "color_mode": "RGB"
    },
    "feature_ids": [
      "eastern_road_astralis_moonlight",
      "lumiera_arch_astralis_moonshadow",
      "sky_chain_moonshadow_griffin_nest"
    ],
    "rasterization": "source-lines-global-native-grid-v1"
  },
  "detail": {
    "status": "explicit-empty",
    "mask": {
      "path": "world/map-production/controls/phase5-metatiles/sheet_region_lumiera_arch_region/c00-r01/detail-mask.png",
      "sha256": "bc1ccaedb8aad8de3e64ef7b2d4fa2099f917e9995488e376bc94899c40c6fa8",
      "width": 2048,
      "height": 2048,
      "format": "PNG",
      "color_mode": "L"
    },
    "authoritative_overlay": {
      "path": "world/map-production/controls/phase5-metatiles/sheet_region_lumiera_arch_region/c00-r01/detail-overlay.png",
      "sha256": "6e84541fac14f31507b9d68f110245775261bfd6f75fb997b4b053e25a0614b0",
      "width": 2048,
      "height": 2048,
      "format": "PNG",
      "color_mode": "RGB"
    },
    "feature_ids": [],
    "provenance": "No reviewed raster-safe detail exists; provisional outlines remain guide-only and labels/POIs remain vector data."
  },
  "unknown_fallback": {
    "policy": "replace-raw-with-parent-context",
    "mask": {
      "path": "world/map-production/controls/phase5-metatiles/sheet_region_lumiera_arch_region/c00-r01/unknown-mask.png",
      "sha256": "bc1ccaedb8aad8de3e64ef7b2d4fa2099f917e9995488e376bc94899c40c6fa8",
      "width": 2048,
      "height": 2048,
      "format": "PNG",
      "color_mode": "L"
    },
    "source": {
      "path": "world/map-production/controls/phase5-metatiles/sheet_region_lumiera_arch_region/c00-r01/parent-context.png",
      "sha256": "5c1500e1ec486bb01f34035bbcb96579075b88e419a58f1b4eebb98b44db45ff",
      "width": 2048,
      "height": 2048,
      "format": "PNG",
      "color_mode": "RGB"
    }
  },
  "source_inputs": {
    "resolution_contract": {
      "path": "world/map-production/spec/resolution-contract.json",
      "sha256": "f65984a6e162e6f60eb93873aa38e0daf1a263975f89cb063092c80389bb0290"
    },
    "map_sheets": {
      "path": "world/map-production/source/map-sheets.json",
      "sha256": "20204c1bf14c8cb7b1204066c1b0755a0a74f62f9c7c6418b76754540a9a3c15"
    },
    "canon_sources": [
      {
        "role": "landmasses",
        "path": "world/map-production/source/landmasses.geojson",
        "sha256": "d5e9600590bf2d122f33405c1f1924a8274a76f4bac1669f35f6adaaaa854b20"
      },
      {
        "role": "regions",
        "path": "world/map-production/source/regions.geojson",
        "sha256": "233053f8ed4214016d8d4c841bceeb5192f5912dfd721325ad9657313752dbb4"
      },
      {
        "role": "terrain",
        "path": "world/map-production/source/terrain.geojson",
        "sha256": "fd186efd744c5dd31d5abe039d23e7fc2f04ff4e689233b48dc4bd9b397ab3aa"
      },
      {
        "role": "hydrography",
        "path": "world/map-production/source/hydrography.geojson",
        "sha256": "33e23b5c85cc41f3ac6a65ced65284b81e04664ae373d85c1afb55dc67f8677d"
      },
      {
        "role": "settlement-footprints",
        "path": "world/map-production/source/settlement-footprints.geojson",
        "sha256": "48baf5f1a4857ef9500b6aab80468356869c5e8651196718a83a78a50cb89974"
      },
      {
        "role": "transport-geometries",
        "path": "world/map-production/source/transport-geometries.geojson",
        "sha256": "4beabac07fbfa6c67a4340f4a45a5199cb4c536e1b081ea5d5ba20a6c19c4565"
      }
    ]
  }
}
