{
  "$schema": "https://sstory.example/schemas/phase5-protected-control.schema.json",
  "schema_version": "1.0.0",
  "type": "sstory-phase5-protected-metatile-control",
  "coordinate_reference_system": "EA-WORLD-1",
  "generated_by": "sstory-map-production/render_phase5_metatile_controls.py@1",
  "sheet_id": "sheet_region_ethernia_core_region",
  "column": 0,
  "row": 0,
  "dimensions": {
    "width": 2048,
    "height": 2048,
    "format": "PNG"
  },
  "visual_geometry_control": {
    "path": "world/map-production/controls/phase5-metatiles/sheet_region_ethernia_core_region/c00-r00/geometry-control.png",
    "sha256": "b0ff3607a07b47af2bf960c3e93797113e2936daebc316b2d6f3fb65af728c92",
    "width": 2048,
    "height": 2048,
    "format": "PNG",
    "color_mode": "RGB"
  },
  "parent_context": {
    "path": "world/map-production/controls/phase5-metatiles/sheet_region_ethernia_core_region/c00-r00/parent-context.png",
    "sha256": "c75a9211c1ed26aaaa37017551ecf09e6cd88469404c6b0cbedb21438123d97f",
    "width": 2048,
    "height": 2048,
    "format": "PNG",
    "color_mode": "RGB"
  },
  "prior_neighbor_contexts": [],
  "land_sea": {
    "land_mask": {
      "path": "world/map-production/controls/phase5-metatiles/sheet_region_ethernia_core_region/c00-r00/land-mask.png",
      "sha256": "00cc9f9e8850718f3050ab1327659fb74465cd7adb2aaa08ef549c5469e6f1a4",
      "width": 2048,
      "height": 2048,
      "format": "PNG",
      "color_mode": "L"
    },
    "water_mask": {
      "path": "world/map-production/controls/phase5-metatiles/sheet_region_ethernia_core_region/c00-r00/water-mask.png",
      "sha256": "bc1ccaedb8aad8de3e64ef7b2d4fa2099f917e9995488e376bc94899c40c6fa8",
      "width": 2048,
      "height": 2048,
      "format": "PNG",
      "color_mode": "L"
    },
    "known_mask": {
      "path": "world/map-production/controls/phase5-metatiles/sheet_region_ethernia_core_region/c00-r00/known-mask.png",
      "sha256": "00cc9f9e8850718f3050ab1327659fb74465cd7adb2aaa08ef549c5469e6f1a4",
      "width": 2048,
      "height": 2048,
      "format": "PNG",
      "color_mode": "L"
    },
    "unknown_mask": {
      "path": "world/map-production/controls/phase5-metatiles/sheet_region_ethernia_core_region/c00-r00/unknown-mask.png",
      "sha256": "78d76074429d9a29613bae63450a2612cd50de014c410ad0b8a4b2f25a4c2271",
      "width": 2048,
      "height": 2048,
      "format": "PNG",
      "color_mode": "L"
    },
    "authoritative_overlay": {
      "path": "world/map-production/controls/phase5-metatiles/sheet_region_ethernia_core_region/c00-r00/land-sea-overlay.png",
      "sha256": "c75a9211c1ed26aaaa37017551ecf09e6cd88469404c6b0cbedb21438123d97f",
      "width": 2048,
      "height": 2048,
      "format": "PNG",
      "color_mode": "RGB"
    },
    "partition": {
      "algorithm": "canon-land-water-unknown-partition-v1",
      "pixel_count": 4194304,
      "land_pixel_count": 2322760,
      "water_pixel_count": 0,
      "unknown_pixel_count": 1871544,
      "overlap_pixel_count": 0,
      "unclassified_pixel_count": 0
    }
  },
  "transport": {
    "mask": {
      "path": "world/map-production/controls/phase5-metatiles/sheet_region_ethernia_core_region/c00-r00/transport-mask.png",
      "sha256": "fe5936f2b25cca0c05c3dc35290b24516a9b7f61091465c7f4d5268a5fd76168",
      "width": 2048,
      "height": 2048,
      "format": "PNG",
      "color_mode": "L"
    },
    "authoritative_overlay": {
      "path": "world/map-production/controls/phase5-metatiles/sheet_region_ethernia_core_region/c00-r00/transport-overlay.png",
      "sha256": "e61f4a4df6717aa344a1fb2de1725d8299c20e5cfd9156ecb91e82fc0b8af7ba",
      "width": 2048,
      "height": 2048,
      "format": "PNG",
      "color_mode": "RGB"
    },
    "feature_ids": [
      "grimoire_barrier_road_labyrinth_spirit_gate",
      "grimoire_chrono_tunnel_labyrinth_sealed_lands",
      "grimoire_north_road_timeport_labyrinth",
      "grimoire_spirit_warp_spirit_gate_ethernia_core",
      "northern_ocean_ironport_timeport"
    ],
    "rasterization": "source-lines-global-native-grid-v1"
  },
  "detail": {
    "status": "explicit-empty",
    "mask": {
      "path": "world/map-production/controls/phase5-metatiles/sheet_region_ethernia_core_region/c00-r00/detail-mask.png",
      "sha256": "bc1ccaedb8aad8de3e64ef7b2d4fa2099f917e9995488e376bc94899c40c6fa8",
      "width": 2048,
      "height": 2048,
      "format": "PNG",
      "color_mode": "L"
    },
    "authoritative_overlay": {
      "path": "world/map-production/controls/phase5-metatiles/sheet_region_ethernia_core_region/c00-r00/detail-overlay.png",
      "sha256": "6e84541fac14f31507b9d68f110245775261bfd6f75fb997b4b053e25a0614b0",
      "width": 2048,
      "height": 2048,
      "format": "PNG",
      "color_mode": "RGB"
    },
    "feature_ids": [],
    "provenance": "No reviewed raster-safe detail exists; provisional outlines remain guide-only and labels/POIs remain vector data."
  },
  "unknown_fallback": {
    "policy": "replace-raw-with-parent-context",
    "mask": {
      "path": "world/map-production/controls/phase5-metatiles/sheet_region_ethernia_core_region/c00-r00/unknown-mask.png",
      "sha256": "78d76074429d9a29613bae63450a2612cd50de014c410ad0b8a4b2f25a4c2271",
      "width": 2048,
      "height": 2048,
      "format": "PNG",
      "color_mode": "L"
    },
    "source": {
      "path": "world/map-production/controls/phase5-metatiles/sheet_region_ethernia_core_region/c00-r00/parent-context.png",
      "sha256": "c75a9211c1ed26aaaa37017551ecf09e6cd88469404c6b0cbedb21438123d97f",
      "width": 2048,
      "height": 2048,
      "format": "PNG",
      "color_mode": "RGB"
    }
  },
  "source_inputs": {
    "resolution_contract": {
      "path": "world/map-production/spec/resolution-contract.json",
      "sha256": "f65984a6e162e6f60eb93873aa38e0daf1a263975f89cb063092c80389bb0290"
    },
    "map_sheets": {
      "path": "world/map-production/source/map-sheets.json",
      "sha256": "20204c1bf14c8cb7b1204066c1b0755a0a74f62f9c7c6418b76754540a9a3c15"
    },
    "canon_sources": [
      {
        "role": "landmasses",
        "path": "world/map-production/source/landmasses.geojson",
        "sha256": "d5e9600590bf2d122f33405c1f1924a8274a76f4bac1669f35f6adaaaa854b20"
      },
      {
        "role": "regions",
        "path": "world/map-production/source/regions.geojson",
        "sha256": "233053f8ed4214016d8d4c841bceeb5192f5912dfd721325ad9657313752dbb4"
      },
      {
        "role": "terrain",
        "path": "world/map-production/source/terrain.geojson",
        "sha256": "fd186efd744c5dd31d5abe039d23e7fc2f04ff4e689233b48dc4bd9b397ab3aa"
      },
      {
        "role": "hydrography",
        "path": "world/map-production/source/hydrography.geojson",
        "sha256": "33e23b5c85cc41f3ac6a65ced65284b81e04664ae373d85c1afb55dc67f8677d"
      },
      {
        "role": "settlement-footprints",
        "path": "world/map-production/source/settlement-footprints.geojson",
        "sha256": "48baf5f1a4857ef9500b6aab80468356869c5e8651196718a83a78a50cb89974"
      },
      {
        "role": "transport-geometries",
        "path": "world/map-production/source/transport-geometries.geojson",
        "sha256": "4beabac07fbfa6c67a4340f4a45a5199cb4c536e1b081ea5d5ba20a6c19c4565"
      }
    ]
  }
}
