{
  "$schema": "https://sstory.example/schemas/phase5-protected-control.schema.json",
  "schema_version": "1.0.0",
  "type": "sstory-phase5-protected-metatile-control",
  "coordinate_reference_system": "EA-WORLD-1",
  "generated_by": "sstory-map-production/render_phase5_metatile_controls.py@1",
  "sheet_id": "sheet_region_emerald_plains_region",
  "column": 0,
  "row": 0,
  "dimensions": {
    "width": 2048,
    "height": 2048,
    "format": "PNG"
  },
  "visual_geometry_control": {
    "path": "world/map-production/controls/phase5-metatiles/sheet_region_emerald_plains_region/c00-r00/geometry-control.png",
    "sha256": "0a31abbcf2a641760a473d57c1fe4d821adc12c59911d5ac6eb342deb86b2d6f",
    "width": 2048,
    "height": 2048,
    "format": "PNG",
    "color_mode": "RGB"
  },
  "parent_context": {
    "path": "world/map-production/controls/phase5-metatiles/sheet_region_emerald_plains_region/c00-r00/parent-context.png",
    "sha256": "76b53999fd727c9e244d0bf7d545303f4147310a1ad56ad3c4cc1f0a924aea4d",
    "width": 2048,
    "height": 2048,
    "format": "PNG",
    "color_mode": "RGB"
  },
  "prior_neighbor_contexts": [],
  "land_sea": {
    "land_mask": {
      "path": "world/map-production/controls/phase5-metatiles/sheet_region_emerald_plains_region/c00-r00/land-mask.png",
      "sha256": "2df0ce9e3655ef456df675530e34d21cb0ba9dd1321146b8b3c434bc3a83e95c",
      "width": 2048,
      "height": 2048,
      "format": "PNG",
      "color_mode": "L"
    },
    "water_mask": {
      "path": "world/map-production/controls/phase5-metatiles/sheet_region_emerald_plains_region/c00-r00/water-mask.png",
      "sha256": "e6e74acb308f59d23e8d0538d368c5aec37bc1aff583e70847af8fe4c9194a67",
      "width": 2048,
      "height": 2048,
      "format": "PNG",
      "color_mode": "L"
    },
    "known_mask": {
      "path": "world/map-production/controls/phase5-metatiles/sheet_region_emerald_plains_region/c00-r00/known-mask.png",
      "sha256": "7a9204d136c794a8bd66220337b8db54e53748ed045adb190ab0ada179d2dddc",
      "width": 2048,
      "height": 2048,
      "format": "PNG",
      "color_mode": "L"
    },
    "unknown_mask": {
      "path": "world/map-production/controls/phase5-metatiles/sheet_region_emerald_plains_region/c00-r00/unknown-mask.png",
      "sha256": "b722e0803bbd477ea3bb2b2f76b2a6d10e279ad75a0faf9d58093c9a4ba5f7c6",
      "width": 2048,
      "height": 2048,
      "format": "PNG",
      "color_mode": "L"
    },
    "authoritative_overlay": {
      "path": "world/map-production/controls/phase5-metatiles/sheet_region_emerald_plains_region/c00-r00/land-sea-overlay.png",
      "sha256": "76b53999fd727c9e244d0bf7d545303f4147310a1ad56ad3c4cc1f0a924aea4d",
      "width": 2048,
      "height": 2048,
      "format": "PNG",
      "color_mode": "RGB"
    },
    "partition": {
      "algorithm": "canon-land-water-unknown-partition-v1",
      "pixel_count": 4194304,
      "land_pixel_count": 3796837,
      "water_pixel_count": 235510,
      "unknown_pixel_count": 161957,
      "overlap_pixel_count": 0,
      "unclassified_pixel_count": 0
    }
  },
  "transport": {
    "mask": {
      "path": "world/map-production/controls/phase5-metatiles/sheet_region_emerald_plains_region/c00-r00/transport-mask.png",
      "sha256": "ff63062c14a2a8503722faf4bd653264d56813ba0b62557c1b491891bf51eff6",
      "width": 2048,
      "height": 2048,
      "format": "PNG",
      "color_mode": "L"
    },
    "authoritative_overlay": {
      "path": "world/map-production/controls/phase5-metatiles/sheet_region_emerald_plains_region/c00-r00/transport-overlay.png",
      "sha256": "d2e2b6b48d00c5b3f138875c9f9d7f19e66ee5270cec164a3d9ab73b0b99e755",
      "width": 2048,
      "height": 2048,
      "format": "PNG",
      "color_mode": "RGB"
    },
    "feature_ids": [
      "astralis_port_zephia_magic_train",
      "central_sea_marineport_jadeport",
      "central_sea_portzephia_marineport",
      "eastern_road_astralis_moonlight",
      "lumiera_arch_astralis_moonshadow",
      "red_desert_caravan_jade_oasis_jade_port",
      "red_sand_coastal_warriorport_jadeport",
      "sky_chain_moonshadow_griffin_nest",
      "sky_chain_wind_rest_moonshadow_isle",
      "southern_air_corridor_astralis_jade_airport",
      "southern_road_blood_fort_jade_port"
    ],
    "rasterization": "source-lines-global-native-grid-v1"
  },
  "detail": {
    "status": "explicit-empty",
    "mask": {
      "path": "world/map-production/controls/phase5-metatiles/sheet_region_emerald_plains_region/c00-r00/detail-mask.png",
      "sha256": "bc1ccaedb8aad8de3e64ef7b2d4fa2099f917e9995488e376bc94899c40c6fa8",
      "width": 2048,
      "height": 2048,
      "format": "PNG",
      "color_mode": "L"
    },
    "authoritative_overlay": {
      "path": "world/map-production/controls/phase5-metatiles/sheet_region_emerald_plains_region/c00-r00/detail-overlay.png",
      "sha256": "6e84541fac14f31507b9d68f110245775261bfd6f75fb997b4b053e25a0614b0",
      "width": 2048,
      "height": 2048,
      "format": "PNG",
      "color_mode": "RGB"
    },
    "feature_ids": [],
    "provenance": "No reviewed raster-safe detail exists; provisional outlines remain guide-only and labels/POIs remain vector data."
  },
  "unknown_fallback": {
    "policy": "replace-raw-with-parent-context",
    "mask": {
      "path": "world/map-production/controls/phase5-metatiles/sheet_region_emerald_plains_region/c00-r00/unknown-mask.png",
      "sha256": "b722e0803bbd477ea3bb2b2f76b2a6d10e279ad75a0faf9d58093c9a4ba5f7c6",
      "width": 2048,
      "height": 2048,
      "format": "PNG",
      "color_mode": "L"
    },
    "source": {
      "path": "world/map-production/controls/phase5-metatiles/sheet_region_emerald_plains_region/c00-r00/parent-context.png",
      "sha256": "76b53999fd727c9e244d0bf7d545303f4147310a1ad56ad3c4cc1f0a924aea4d",
      "width": 2048,
      "height": 2048,
      "format": "PNG",
      "color_mode": "RGB"
    }
  },
  "source_inputs": {
    "resolution_contract": {
      "path": "world/map-production/spec/resolution-contract.json",
      "sha256": "f65984a6e162e6f60eb93873aa38e0daf1a263975f89cb063092c80389bb0290"
    },
    "map_sheets": {
      "path": "world/map-production/source/map-sheets.json",
      "sha256": "20204c1bf14c8cb7b1204066c1b0755a0a74f62f9c7c6418b76754540a9a3c15"
    },
    "canon_sources": [
      {
        "role": "landmasses",
        "path": "world/map-production/source/landmasses.geojson",
        "sha256": "d5e9600590bf2d122f33405c1f1924a8274a76f4bac1669f35f6adaaaa854b20"
      },
      {
        "role": "regions",
        "path": "world/map-production/source/regions.geojson",
        "sha256": "233053f8ed4214016d8d4c841bceeb5192f5912dfd721325ad9657313752dbb4"
      },
      {
        "role": "terrain",
        "path": "world/map-production/source/terrain.geojson",
        "sha256": "fd186efd744c5dd31d5abe039d23e7fc2f04ff4e689233b48dc4bd9b397ab3aa"
      },
      {
        "role": "hydrography",
        "path": "world/map-production/source/hydrography.geojson",
        "sha256": "33e23b5c85cc41f3ac6a65ced65284b81e04664ae373d85c1afb55dc67f8677d"
      },
      {
        "role": "settlement-footprints",
        "path": "world/map-production/source/settlement-footprints.geojson",
        "sha256": "48baf5f1a4857ef9500b6aab80468356869c5e8651196718a83a78a50cb89974"
      },
      {
        "role": "transport-geometries",
        "path": "world/map-production/source/transport-geometries.geojson",
        "sha256": "4beabac07fbfa6c67a4340f4a45a5199cb4c536e1b081ea5d5ba20a6c19c4565"
      }
    ]
  }
}
