{
  "$schema": "https://sstory.example/schemas/phase5-protected-control.schema.json",
  "schema_version": "1.0.0",
  "type": "sstory-phase5-protected-metatile-control",
  "coordinate_reference_system": "EA-WORLD-1",
  "generated_by": "sstory-map-production/render_phase5_metatile_controls.py@1",
  "sheet_id": "sheet_region_emerald_plains_region",
  "column": 0,
  "row": 1,
  "dimensions": {
    "width": 2048,
    "height": 2048,
    "format": "PNG"
  },
  "visual_geometry_control": {
    "path": "world/map-production/controls/phase5-metatiles/sheet_region_emerald_plains_region/c00-r01/geometry-control.png",
    "sha256": "3f18dcbe4e1b9115f28154d21531f67ab68293710493c4ffc06bb9c2c471bc3f",
    "width": 2048,
    "height": 2048,
    "format": "PNG",
    "color_mode": "RGB"
  },
  "parent_context": {
    "path": "world/map-production/controls/phase5-metatiles/sheet_region_emerald_plains_region/c00-r01/parent-context.png",
    "sha256": "a47756f126e6199b9ece11473422c65ae264784a19a031914f57c2f2ee64e188",
    "width": 2048,
    "height": 2048,
    "format": "PNG",
    "color_mode": "RGB"
  },
  "prior_neighbor_contexts": [
    {
      "direction": "north",
      "source_tile": {
        "column": 0,
        "row": 0
      },
      "context": {
        "path": "world/map-production/controls/phase5-metatiles/sheet_region_emerald_plains_region/c00-r01/neighbor-north-geometry-context.png",
        "sha256": "0a31abbcf2a641760a473d57c1fe4d821adc12c59911d5ac6eb342deb86b2d6f",
        "width": 2048,
        "height": 2048,
        "format": "PNG",
        "color_mode": "RGB"
      }
    }
  ],
  "land_sea": {
    "land_mask": {
      "path": "world/map-production/controls/phase5-metatiles/sheet_region_emerald_plains_region/c00-r01/land-mask.png",
      "sha256": "065f844fbeee2c1dffeae587c3c765b22b0bd6ed8beb137a01211356e9765847",
      "width": 2048,
      "height": 2048,
      "format": "PNG",
      "color_mode": "L"
    },
    "water_mask": {
      "path": "world/map-production/controls/phase5-metatiles/sheet_region_emerald_plains_region/c00-r01/water-mask.png",
      "sha256": "0efd49bdabef750d3453e05211a6475946fd10f404854e9a030b4c9ecfa73718",
      "width": 2048,
      "height": 2048,
      "format": "PNG",
      "color_mode": "L"
    },
    "known_mask": {
      "path": "world/map-production/controls/phase5-metatiles/sheet_region_emerald_plains_region/c00-r01/known-mask.png",
      "sha256": "f871064151fc53b5573aa58f92002004c6f469cfeab53e41f41c30056ef48901",
      "width": 2048,
      "height": 2048,
      "format": "PNG",
      "color_mode": "L"
    },
    "unknown_mask": {
      "path": "world/map-production/controls/phase5-metatiles/sheet_region_emerald_plains_region/c00-r01/unknown-mask.png",
      "sha256": "5c8fe10b8c13b2814309261f84ccbe2d662ce5c28724dfb94b7688fb45e66de0",
      "width": 2048,
      "height": 2048,
      "format": "PNG",
      "color_mode": "L"
    },
    "authoritative_overlay": {
      "path": "world/map-production/controls/phase5-metatiles/sheet_region_emerald_plains_region/c00-r01/land-sea-overlay.png",
      "sha256": "a47756f126e6199b9ece11473422c65ae264784a19a031914f57c2f2ee64e188",
      "width": 2048,
      "height": 2048,
      "format": "PNG",
      "color_mode": "RGB"
    },
    "partition": {
      "algorithm": "canon-land-water-unknown-partition-v1",
      "pixel_count": 4194304,
      "land_pixel_count": 1045515,
      "water_pixel_count": 58357,
      "unknown_pixel_count": 3090432,
      "overlap_pixel_count": 0,
      "unclassified_pixel_count": 0
    }
  },
  "transport": {
    "mask": {
      "path": "world/map-production/controls/phase5-metatiles/sheet_region_emerald_plains_region/c00-r01/transport-mask.png",
      "sha256": "71e09725beae2fb930b27c14c0d5a705fa2f1a369fc12ae99cd196825867ad90",
      "width": 2048,
      "height": 2048,
      "format": "PNG",
      "color_mode": "L"
    },
    "authoritative_overlay": {
      "path": "world/map-production/controls/phase5-metatiles/sheet_region_emerald_plains_region/c00-r01/transport-overlay.png",
      "sha256": "35b31b249046bbb5cb293181d0bde098e4f3848a1f01db71e2ff5ec013aafdc8",
      "width": 2048,
      "height": 2048,
      "format": "PNG",
      "color_mode": "RGB"
    },
    "feature_ids": [
      "central_road_jade_north_jade_capital",
      "central_sea_marineport_jadeport",
      "red_desert_caravan_jade_oasis_jade_port",
      "red_sand_coastal_warriorport_jadeport",
      "southern_air_corridor_astralis_jade_airport",
      "southern_road_blood_fort_jade_port"
    ],
    "rasterization": "source-lines-global-native-grid-v1"
  },
  "detail": {
    "status": "explicit-empty",
    "mask": {
      "path": "world/map-production/controls/phase5-metatiles/sheet_region_emerald_plains_region/c00-r01/detail-mask.png",
      "sha256": "bc1ccaedb8aad8de3e64ef7b2d4fa2099f917e9995488e376bc94899c40c6fa8",
      "width": 2048,
      "height": 2048,
      "format": "PNG",
      "color_mode": "L"
    },
    "authoritative_overlay": {
      "path": "world/map-production/controls/phase5-metatiles/sheet_region_emerald_plains_region/c00-r01/detail-overlay.png",
      "sha256": "6e84541fac14f31507b9d68f110245775261bfd6f75fb997b4b053e25a0614b0",
      "width": 2048,
      "height": 2048,
      "format": "PNG",
      "color_mode": "RGB"
    },
    "feature_ids": [],
    "provenance": "No reviewed raster-safe detail exists; provisional outlines remain guide-only and labels/POIs remain vector data."
  },
  "unknown_fallback": {
    "policy": "replace-raw-with-parent-context",
    "mask": {
      "path": "world/map-production/controls/phase5-metatiles/sheet_region_emerald_plains_region/c00-r01/unknown-mask.png",
      "sha256": "5c8fe10b8c13b2814309261f84ccbe2d662ce5c28724dfb94b7688fb45e66de0",
      "width": 2048,
      "height": 2048,
      "format": "PNG",
      "color_mode": "L"
    },
    "source": {
      "path": "world/map-production/controls/phase5-metatiles/sheet_region_emerald_plains_region/c00-r01/parent-context.png",
      "sha256": "a47756f126e6199b9ece11473422c65ae264784a19a031914f57c2f2ee64e188",
      "width": 2048,
      "height": 2048,
      "format": "PNG",
      "color_mode": "RGB"
    }
  },
  "source_inputs": {
    "resolution_contract": {
      "path": "world/map-production/spec/resolution-contract.json",
      "sha256": "f65984a6e162e6f60eb93873aa38e0daf1a263975f89cb063092c80389bb0290"
    },
    "map_sheets": {
      "path": "world/map-production/source/map-sheets.json",
      "sha256": "20204c1bf14c8cb7b1204066c1b0755a0a74f62f9c7c6418b76754540a9a3c15"
    },
    "canon_sources": [
      {
        "role": "landmasses",
        "path": "world/map-production/source/landmasses.geojson",
        "sha256": "d5e9600590bf2d122f33405c1f1924a8274a76f4bac1669f35f6adaaaa854b20"
      },
      {
        "role": "regions",
        "path": "world/map-production/source/regions.geojson",
        "sha256": "233053f8ed4214016d8d4c841bceeb5192f5912dfd721325ad9657313752dbb4"
      },
      {
        "role": "terrain",
        "path": "world/map-production/source/terrain.geojson",
        "sha256": "fd186efd744c5dd31d5abe039d23e7fc2f04ff4e689233b48dc4bd9b397ab3aa"
      },
      {
        "role": "hydrography",
        "path": "world/map-production/source/hydrography.geojson",
        "sha256": "33e23b5c85cc41f3ac6a65ced65284b81e04664ae373d85c1afb55dc67f8677d"
      },
      {
        "role": "settlement-footprints",
        "path": "world/map-production/source/settlement-footprints.geojson",
        "sha256": "48baf5f1a4857ef9500b6aab80468356869c5e8651196718a83a78a50cb89974"
      },
      {
        "role": "transport-geometries",
        "path": "world/map-production/source/transport-geometries.geojson",
        "sha256": "4beabac07fbfa6c67a4340f4a45a5199cb4c536e1b081ea5d5ba20a6c19c4565"
      }
    ]
  }
}
