{
  "$schema": "https://sstory.example/schemas/phase5-protected-control.schema.json",
  "schema_version": "1.0.0",
  "type": "sstory-phase5-protected-metatile-control",
  "coordinate_reference_system": "EA-WORLD-1",
  "generated_by": "sstory-map-production/render_phase5_metatile_controls.py@1",
  "sheet_id": "sheet_region_royal_capital_region",
  "column": 0,
  "row": 0,
  "dimensions": {
    "width": 2048,
    "height": 2048,
    "format": "PNG"
  },
  "visual_geometry_control": {
    "path": "world/map-production/controls/phase5-metatiles/sheet_region_royal_capital_region/c00-r00/geometry-control.png",
    "sha256": "dfa7370a9add492f83c3c61f9c3a0d00582d642c984243101f4c1e2f216cd674",
    "width": 2048,
    "height": 2048,
    "format": "PNG",
    "color_mode": "RGB"
  },
  "parent_context": {
    "path": "world/map-production/controls/phase5-metatiles/sheet_region_royal_capital_region/c00-r00/parent-context.png",
    "sha256": "5358dc0ce90d5fdc1fb61b731172c013eafc0ea90e7c2dfae2cb773e64877441",
    "width": 2048,
    "height": 2048,
    "format": "PNG",
    "color_mode": "RGB"
  },
  "prior_neighbor_contexts": [],
  "land_sea": {
    "land_mask": {
      "path": "world/map-production/controls/phase5-metatiles/sheet_region_royal_capital_region/c00-r00/land-mask.png",
      "sha256": "a856e8cb8389d1887bf5761678c4fcb73dd6914fd05c6e7f2aeadbca57ce3106",
      "width": 2048,
      "height": 2048,
      "format": "PNG",
      "color_mode": "L"
    },
    "water_mask": {
      "path": "world/map-production/controls/phase5-metatiles/sheet_region_royal_capital_region/c00-r00/water-mask.png",
      "sha256": "a0b77a5a53343eccf444e335fce2745d2a0534a99c124f26b6fafb54250131f9",
      "width": 2048,
      "height": 2048,
      "format": "PNG",
      "color_mode": "L"
    },
    "known_mask": {
      "path": "world/map-production/controls/phase5-metatiles/sheet_region_royal_capital_region/c00-r00/known-mask.png",
      "sha256": "a9e64ca9c63e341485dc03090d1c5e7dfb2fd02f0e78b006ffa5cb1f167e7043",
      "width": 2048,
      "height": 2048,
      "format": "PNG",
      "color_mode": "L"
    },
    "unknown_mask": {
      "path": "world/map-production/controls/phase5-metatiles/sheet_region_royal_capital_region/c00-r00/unknown-mask.png",
      "sha256": "2a4db1e8f0a98b68e140ce7aedb061a469a0096c3002b5f7334a62ea6118984b",
      "width": 2048,
      "height": 2048,
      "format": "PNG",
      "color_mode": "L"
    },
    "authoritative_overlay": {
      "path": "world/map-production/controls/phase5-metatiles/sheet_region_royal_capital_region/c00-r00/land-sea-overlay.png",
      "sha256": "5358dc0ce90d5fdc1fb61b731172c013eafc0ea90e7c2dfae2cb773e64877441",
      "width": 2048,
      "height": 2048,
      "format": "PNG",
      "color_mode": "RGB"
    },
    "partition": {
      "algorithm": "canon-land-water-unknown-partition-v1",
      "pixel_count": 4194304,
      "land_pixel_count": 2624756,
      "water_pixel_count": 114367,
      "unknown_pixel_count": 1455181,
      "overlap_pixel_count": 0,
      "unclassified_pixel_count": 0
    }
  },
  "transport": {
    "mask": {
      "path": "world/map-production/controls/phase5-metatiles/sheet_region_royal_capital_region/c00-r00/transport-mask.png",
      "sha256": "b4700ecf464f65f8ee87786871d651af1ebe8d9a95c55983b364faad3cdbc6ac",
      "width": 2048,
      "height": 2048,
      "format": "PNG",
      "color_mode": "L"
    },
    "authoritative_overlay": {
      "path": "world/map-production/controls/phase5-metatiles/sheet_region_royal_capital_region/c00-r00/transport-overlay.png",
      "sha256": "769ccc2f7e2d2e993f22c3ea6b3e7b8f4f16021cc8a15cdea3e09e13d02b4df7",
      "width": 2048,
      "height": 2048,
      "format": "PNG",
      "color_mode": "RGB"
    },
    "feature_ids": [
      "astralis_loop_line",
      "astralis_port_zephia_magic_train",
      "central_road_astralis_granrock",
      "central_road_granrock_jade_north",
      "central_sea_marineport_jadeport",
      "central_sea_portzephia_marineport",
      "eastern_road_astralis_moonlight",
      "lumiera_arch_astralis_moonshadow",
      "northern_ocean_ironport_timeport",
      "sky_chain_astralis_wind_rest",
      "sky_chain_eye_of_storm_stormhold",
      "sky_chain_griffin_nest_eye_of_storm",
      "sky_chain_moonshadow_griffin_nest",
      "sky_chain_wind_rest_moonshadow_isle",
      "southern_air_corridor_astralis_jade_airport",
      "southern_road_astralis_blood_fort",
      "western_air_corridor_astralis_atlantis_base"
    ],
    "rasterization": "source-lines-global-native-grid-v1"
  },
  "detail": {
    "status": "explicit-empty",
    "mask": {
      "path": "world/map-production/controls/phase5-metatiles/sheet_region_royal_capital_region/c00-r00/detail-mask.png",
      "sha256": "bc1ccaedb8aad8de3e64ef7b2d4fa2099f917e9995488e376bc94899c40c6fa8",
      "width": 2048,
      "height": 2048,
      "format": "PNG",
      "color_mode": "L"
    },
    "authoritative_overlay": {
      "path": "world/map-production/controls/phase5-metatiles/sheet_region_royal_capital_region/c00-r00/detail-overlay.png",
      "sha256": "6e84541fac14f31507b9d68f110245775261bfd6f75fb997b4b053e25a0614b0",
      "width": 2048,
      "height": 2048,
      "format": "PNG",
      "color_mode": "RGB"
    },
    "feature_ids": [],
    "provenance": "No reviewed raster-safe detail exists; provisional outlines remain guide-only and labels/POIs remain vector data."
  },
  "unknown_fallback": {
    "policy": "replace-raw-with-parent-context",
    "mask": {
      "path": "world/map-production/controls/phase5-metatiles/sheet_region_royal_capital_region/c00-r00/unknown-mask.png",
      "sha256": "2a4db1e8f0a98b68e140ce7aedb061a469a0096c3002b5f7334a62ea6118984b",
      "width": 2048,
      "height": 2048,
      "format": "PNG",
      "color_mode": "L"
    },
    "source": {
      "path": "world/map-production/controls/phase5-metatiles/sheet_region_royal_capital_region/c00-r00/parent-context.png",
      "sha256": "5358dc0ce90d5fdc1fb61b731172c013eafc0ea90e7c2dfae2cb773e64877441",
      "width": 2048,
      "height": 2048,
      "format": "PNG",
      "color_mode": "RGB"
    }
  },
  "source_inputs": {
    "resolution_contract": {
      "path": "world/map-production/spec/resolution-contract.json",
      "sha256": "f65984a6e162e6f60eb93873aa38e0daf1a263975f89cb063092c80389bb0290"
    },
    "map_sheets": {
      "path": "world/map-production/source/map-sheets.json",
      "sha256": "20204c1bf14c8cb7b1204066c1b0755a0a74f62f9c7c6418b76754540a9a3c15"
    },
    "canon_sources": [
      {
        "role": "landmasses",
        "path": "world/map-production/source/landmasses.geojson",
        "sha256": "d5e9600590bf2d122f33405c1f1924a8274a76f4bac1669f35f6adaaaa854b20"
      },
      {
        "role": "regions",
        "path": "world/map-production/source/regions.geojson",
        "sha256": "233053f8ed4214016d8d4c841bceeb5192f5912dfd721325ad9657313752dbb4"
      },
      {
        "role": "terrain",
        "path": "world/map-production/source/terrain.geojson",
        "sha256": "fd186efd744c5dd31d5abe039d23e7fc2f04ff4e689233b48dc4bd9b397ab3aa"
      },
      {
        "role": "hydrography",
        "path": "world/map-production/source/hydrography.geojson",
        "sha256": "33e23b5c85cc41f3ac6a65ced65284b81e04664ae373d85c1afb55dc67f8677d"
      },
      {
        "role": "settlement-footprints",
        "path": "world/map-production/source/settlement-footprints.geojson",
        "sha256": "48baf5f1a4857ef9500b6aab80468356869c5e8651196718a83a78a50cb89974"
      },
      {
        "role": "transport-geometries",
        "path": "world/map-production/source/transport-geometries.geojson",
        "sha256": "4beabac07fbfa6c67a4340f4a45a5199cb4c536e1b081ea5d5ba20a6c19c4565"
      }
    ]
  }
}
